{
  "schemaVersion": "1.0.0",
  "bookId": "peterpan-sticker-pilot",
  "title": {
    "zh-Hant": "彼得潘｜貼紙童話試作"
  },
  "source": {
    "work": "Peter and Wendy",
    "author": "J. M. Barrie",
    "edition": "1911",
    "rightsReview": "pending",
    "draftOrigin": "ai-generated",
    "translation": "本專案繁體中文改寫",
    "translationCredit": "待指定",
    "notes": "第四本為互動貼紙試作；原著與新譯文、插圖之權利仍待人工審核。"
  },
  "artStyleId": "cozy-sticker-v1",
  "chapters": [
    {
      "id": "ch1",
      "title": {
        "zh-Hant": "貼紙童話試作"
      },
      "pageIds": [
        "p1",
        "p2",
        "p3"
      ]
    }
  ],
  "stickers": [
    {
      "id": "peter",
      "label": {
        "zh-Hant": "彼得潘"
      },
      "storyLabel": "彼得潘",
      "kind": "character",
      "defaultAsset": "assets/peter.svg",
      "variants": {
        "sky-flyer": "assets/peter-flying.svg",
        "sky-magic": "assets/peter-flying.svg"
      }
    },
    {
      "id": "wendy",
      "label": {
        "zh-Hant": "溫蒂"
      },
      "storyLabel": "溫蒂",
      "kind": "character",
      "defaultAsset": "assets/wendy.svg",
      "variants": {
        "sky-flyer": "assets/wendy-flying.svg",
        "sky-magic": "assets/wendy-flying.svg"
      }
    },
    {
      "id": "boys",
      "label": {
        "zh-Hant": "迷失男孩"
      },
      "storyLabel": "迷失男孩",
      "kind": "character",
      "defaultAsset": "assets/boys.svg",
      "variants": {
        "sky-flyer": "assets/boys-flying.svg",
        "sky-magic": "assets/boys-flying.svg",
        "forest-helper": "assets/boys-building.svg"
      }
    },
    {
      "id": "shadow",
      "label": {
        "zh-Hant": "影子"
      },
      "storyLabel": "影子",
      "kind": "prop",
      "defaultAsset": "assets/shadow.svg",
      "variants": {
        "room-discovery": "assets/shadow-floor.svg",
        "sky-flyer": "assets/shadow-flying.svg",
        "sky-magic": "assets/shadow-flying.svg"
      }
    },
    {
      "id": "dust",
      "label": {
        "zh-Hant": "仙塵"
      },
      "storyLabel": "仙塵",
      "kind": "prop",
      "defaultAsset": "assets/dust.svg",
      "variants": {
        "sky-flyer": "assets/dust-flying.svg",
        "sky-magic": "assets/dust-flying.svg"
      }
    },
    {
      "id": "house",
      "label": {
        "zh-Hant": "樹葉小屋"
      },
      "storyLabel": "樹葉小屋",
      "kind": "prop",
      "defaultAsset": "assets/house.svg",
      "variants": {
        "sky-flyer": "assets/house-flying.svg",
        "sky-magic": "assets/house-flying.svg"
      }
    }
  ],
  "pages": [
    {
      "id": "p1",
      "chapterId": "ch1",
      "title": {
        "zh-Hant": "窗邊的祕密"
      },
      "kicker": "第一章 · 育兒室",
      "clue": {
        "zh-Hant": "誰發現了育兒室裡的祕密？又留下了什麼？"
      },
      "sceneAsset": "assets/room.svg",
      "sceneRole": "room",
      "slots": [
        {
          "id": "visitor",
          "role": "room-visitor",
          "frame": {
            "left": 20,
            "bottom": 9,
            "width": 25,
            "height": 44.44
          },
          "hint": {
            "zh-Hant": "一位發現祕密的女孩"
          }
        },
        {
          "id": "clue",
          "role": "room-discovery",
          "frame": {
            "left": 54,
            "bottom": 9,
            "width": 18,
            "height": 32
          },
          "hint": {
            "zh-Hant": "一片會偷偷逃跑的東西"
          }
        }
      ],
      "paragraphs": [
        {
          "id": "p1-t1",
          "parts": [
            {
              "type": "text",
              "value": "倫敦的夜晚，月光輕輕灑在育兒室的地板上。"
            },
            {
              "type": "slot",
              "slotId": "visitor"
            },
            {
              "type": "text",
              "value": "聽見窗邊傳來一陣小小的笑聲，便走近查看。"
            }
          ]
        },
        {
          "id": "p1-t2",
          "parts": [
            {
              "type": "text",
              "value": "她低下頭，看見地板上遺落了"
            },
            {
              "type": "slot",
              "slotId": "clue"
            },
            {
              "type": "text",
              "value": "。原來那位神祕的訪客，真的曾經來過這個房間。"
            }
          ]
        }
      ],
      "ruleIds": [
        "p1-wendy-shadow",
        "p1-peter-shadow",
        "p1-wendy-dust",
        "p1-peter-dust",
        "p1-boys-shadow",
        "p1-wendy-house",
        "p1-boys-house",
        "p1-dust-house",
        "p1-shadow-visitor",
        "p1-any"
      ]
    },
    {
      "id": "p2",
      "chapterId": "ch1",
      "title": {
        "zh-Hant": "第二顆星的方向"
      },
      "kicker": "第一章 · 倫敦上空",
      "clue": {
        "zh-Hant": "誰帶領孩子們出發？哪種魔法讓大家飛起來？"
      },
      "sceneAsset": "assets/sky.svg",
      "sceneRole": "sky",
      "slots": [
        {
          "id": "hero",
          "role": "sky-flyer",
          "frame": {
            "left": 28,
            "bottom": 22,
            "width": 22,
            "height": 39.11
          },
          "hint": {
            "zh-Hant": "一位會飛的男孩"
          }
        },
        {
          "id": "magic",
          "role": "sky-magic",
          "frame": {
            "left": 58,
            "bottom": 21,
            "width": 15,
            "height": 26.67
          },
          "hint": {
            "zh-Hant": "一瓶會發光的魔法"
          }
        }
      ],
      "paragraphs": [
        {
          "id": "p2-t1",
          "parts": [
            {
              "type": "text",
              "value": "窗外的倫敦愈來愈小，"
            },
            {
              "type": "slot",
              "slotId": "hero"
            },
            {
              "type": "text",
              "value": "在雲端回頭微笑，邀請朋友們一起飛行。"
            }
          ]
        },
        {
          "id": "p2-t2",
          "parts": [
            {
              "type": "text",
              "value": "他撒下"
            },
            {
              "type": "slot",
              "slotId": "magic"
            },
            {
              "type": "text",
              "value": "，星光便圍著孩子們轉圈。月亮安靜地守在天際，而全新的冒險才剛開始。"
            }
          ]
        }
      ],
      "ruleIds": [
        "p2-after-shadow",
        "p2-peter-dust",
        "p2-wendy-dust",
        "p2-boys-dust",
        "p2-peter-shadow",
        "p2-wendy-shadow",
        "p2-peter-house",
        "p2-peter-no-fact",
        "p2-any"
      ]
    },
    {
      "id": "p3",
      "chapterId": "ch1",
      "title": {
        "zh-Hant": "為朋友蓋一座小屋"
      },
      "kicker": "第一章 · 夢幻島",
      "clue": {
        "zh-Hant": "誰忙著幫溫蒂蓋房子？他們蓋出什麼？"
      },
      "sceneAsset": "assets/forest.svg",
      "sceneRole": "forest",
      "slots": [
        {
          "id": "helper",
          "role": "forest-helper",
          "frame": {
            "left": 16,
            "bottom": 9,
            "width": 28,
            "height": 49.78
          },
          "hint": {
            "zh-Hant": "一群想交朋友的孩子"
          }
        },
        {
          "id": "result",
          "role": "forest-result",
          "frame": {
            "left": 45,
            "bottom": 12,
            "width": 28,
            "height": 49.78
          },
          "hint": {
            "zh-Hant": "一間用樹葉搭成的小屋"
          }
        }
      ],
      "paragraphs": [
        {
          "id": "p3-t1",
          "parts": [
            {
              "type": "text",
              "value": "夢幻島的森林裡，"
            },
            {
              "type": "slot",
              "slotId": "helper"
            },
            {
              "type": "text",
              "value": "忙著搬樹枝、撿花朵，希望讓新朋友有個能安心休息的地方。"
            }
          ]
        },
        {
          "id": "p3-t2",
          "parts": [
            {
              "type": "text",
              "value": "不一會兒，草地上出現了"
            },
            {
              "type": "slot",
              "slotId": "result"
            },
            {
              "type": "text",
              "value": "。森林裡充滿笑聲，大家開心地邀請溫蒂住下。"
            }
          ]
        }
      ],
      "ruleIds": [
        "p3-after-dust",
        "p3-boys-house",
        "p3-boys-only",
        "p3-house-only",
        "p3-wendy-house",
        "p3-peter-house",
        "p3-boys-shadow",
        "p3-any"
      ]
    }
  ],
  "rules": [
    {
      "id": "p1-wendy-shadow",
      "pageId": "p1",
      "priority": 100,
      "group": "main",
      "when": {
        "all": [
          {
            "slotEquals": [
              "visitor",
              "wendy"
            ]
          },
          {
            "slotEquals": [
              "clue",
              "shadow"
            ]
          }
        ]
      },
      "then": {
        "eventId": "shadowRecovered",
        "setFacts": {
          "shadowRecovered": true,
          "windowOpen": true
        },
        "narrativeId": "n-p1-wendy-shadow",
        "variantOverrides": {
          "clue": "assets/shadow-floor.svg"
        }
      }
    },
    {
      "id": "p1-peter-shadow",
      "pageId": "p1",
      "priority": 99,
      "group": "main",
      "when": {
        "all": [
          {
            "slotEquals": [
              "visitor",
              "peter"
            ]
          },
          {
            "slotEquals": [
              "clue",
              "shadow"
            ]
          }
        ]
      },
      "then": {
        "eventId": "peterClaimsShadow",
        "setFacts": {
          "shadowRecovered": true,
          "peterArrived": true
        },
        "narrativeId": "n-p1-peter-shadow",
        "variantOverrides": {
          "clue": "assets/shadow-floor.svg"
        }
      }
    },
    {
      "id": "p1-wendy-dust",
      "pageId": "p1",
      "priority": 95,
      "group": "main",
      "when": {
        "all": [
          {
            "slotEquals": [
              "visitor",
              "wendy"
            ]
          },
          {
            "slotEquals": [
              "clue",
              "dust"
            ]
          }
        ]
      },
      "then": {